[
  {
    "id": "00699504-1e14-4f63-b9c3-29030de78af0",
    "character": "\u521D\u97F3\u672A\u6765",
    "franchise": "",
    "month": 8,
    "day": 31,
    "enabled": true,
    "source": "MANUAL",
    "sourceUrl": "",
    "evidence": ""
  },
  {
    "id": "715c63e6-73d3-4ce0-b69b-42af131ab8ea",
    "character": "\u6D41\u6D6A\u8005",
    "franchise": "GENSHIN",
    "month": 1,
    "day": 3,
    "enabled": true,
    "source": "qimiao-import.json",
    "sourceUrl": "",
    "evidence": ""
  },
  {
    "id": "f9422d4b-eb6d-48a7-8587-4edd1de30b03",
    "character": "\u96C5\u73C2\u8FBE",
    "franchise": "GENSHIN",
    "month": 1,
    "day": 5,
    "enabled": true,
    "source": "qimiao-import.json",
    "sourceUrl": "",
    "evidence": ""
  },
  {
    "id": "d1c7528b-f16e-4e6d-9c61-d6823be0b3bf",
    "character": "\u84DD\u781A",
    "franchise": "GENSHIN",
    "month": 1,
    "day": 6,
    "enabled": true,
    "source": "qimiao-import.json",
    "sourceUrl": "",
    "evidence": ""
  },
  {
    "id": "49d4c086-6f3e-48d1-838d-915e7a89c062",
    "character": "\u6258\u9A6C",
    "franchise": "GENSHIN",
    "month": 1,
    "day": 9,
    "enabled": true,
    "source": "qimiao-import.json",
    "sourceUrl": "",
    "evidence": ""
  },
  {
    "id": "b0c7daa0-7f14-45e7-99f5-bad6832aac13",
    "character": "\u590F\u6C83\u857E",
    "franchise": "GENSHIN",
    "month": 1,
    "day": 10,
    "enabled": true,
    "source": "qimiao-import.json",
    "sourceUrl": "",
    "evidence": ""
  },
  {
    "id": "1560fd43-ede9-474e-b63b-37bb650ca3db",
    "character": "\u6851\u591A\u6D85",
    "franchise": "GENSHIN",
    "month": 1,
    "day": 13,
    "enabled": true,
    "source": "qimiao-import.json",
    "sourceUrl": "",
    "evidence": ""
  },
  {
    "id": "ca301e4a-361e-43fc-83ad-0ece53b8b1f1",
    "character": "\u8FEA\u5965\u5A1C",
    "franchise": "GENSHIN",
    "month": 1,
    "day": 18,
    "enabled": true,
    "source": "qimiao-import.json",
    "sourceUrl": "",
    "evidence": ""
  },
  {
    "id": "8acea3f3-dfa1-440a-a2b2-6c4ce5c818e1",
    "character": "\u831C\u7279\u83C8\u8389",
    "franchise": "GENSHIN",
    "month": 1,
    "day": 20,
    "enabled": true,
    "source": "qimiao-import.json",
    "sourceUrl": "",
    "evidence": ""
  },
  {
    "id": "42ad39bd-c69f-4704-83e8-e6cf18cfafe6",
    "character": "\u7EEE\u826F\u826F",
    "franchise": "GENSHIN",
    "month": 1,
    "day": 22,
    "enabled": true,
    "source": "qimiao-import.json",
    "sourceUrl": "",
    "evidence": ""
  },
  {
    "id": "8272cb9e-ac4e-4b59-8a90-bec16805ac9e",
    "character": "\u7F57\u838E\u8389\u4E9A",
    "franchise": "GENSHIN",
    "month": 1,
    "day": 24,
    "enabled": true,
    "source": "qimiao-import.json",
    "sourceUrl": "",
    "evidence": ""
  },
  {
    "id": "0e02aa16-b46c-4d42-a6cf-e7d8f6755ca2",
    "character": "\u6797\u5C3C",
    "franchise": "GENSHIN",
    "month": 2,
    "day": 2,
    "enabled": true,
    "source": "qimiao-import.json",
    "sourceUrl": "",
    "evidence": ""
  },
  {
    "id": "e068c38a-5a18-4250-a194-66bde82d8e83",
    "character": "\u7433\u59AE\u7279",
    "franchise": "GENSHIN",
    "month": 2,
    "day": 2,
    "enabled": true,
    "source": "qimiao-import.json",
    "sourceUrl": "",
    "evidence": ""
  },
  {
    "id": "e77ae353-703f-47fe-b8c2-9e8d748e6500",
    "character": "\u963F\u7F57\u590F",
    "franchise": "GENSHIN",
    "month": 2,
    "day": 9,
    "enabled": true,
    "source": "qimiao-import.json",
    "sourceUrl": "",
    "evidence": ""
  },
  {
    "id": "106243e6-7fff-4a3c-b36f-401cd140397c",
    "character": "\u827E\u5C14\u6D77\u68EE",
    "franchise": "GENSHIN",
    "month": 2,
    "day": 11,
    "enabled": true,
    "source": "qimiao-import.json",
    "sourceUrl": "",
    "evidence": ""
  },
  {
    "id": "8affa959-4084-416f-83d4-f9b8b043d9a1",
    "character": "\u5317\u6597",
    "franchise": "GENSHIN",
    "month": 2,
    "day": 14,
    "enabled": true,
    "source": "qimiao-import.json",
    "sourceUrl": "",
    "evidence": ""
  },
  {
    "id": "8a28cf89-ffc2-4eb1-8ac2-af5f60da2b3c",
    "character": "\u6CD5\u5C14\u4F3D",
    "franchise": "GENSHIN",
    "month": 2,
    "day": 17,
    "enabled": true,
    "source": "qimiao-import.json",
    "sourceUrl": "",
    "evidence": ""
  },
  {
    "id": "bdc4bf31-cd41-41c1-bb92-6a2704d3fb98",
    "character": "\u5965\u9EDB\u5854",
    "franchise": "GENSHIN",
    "month": 2,
    "day": 20,
    "enabled": true,
    "source": "qimiao-import.json",
    "sourceUrl": "",
    "evidence": ""
  },
  {
    "id": "bf5dfae6-fdd7-4b08-be4f-741e2c363fb9",
    "character": "\u73CA\u745A\u5BAB\u5FC3\u6D77",
    "franchise": "GENSHIN",
    "month": 2,
    "day": 22,
    "enabled": true,
    "source": "qimiao-import.json",
    "sourceUrl": "",
    "evidence": ""
  },
  {
    "id": "b1ddd2bb-4050-4f9b-84c0-c8108403b7e7",
    "character": "\u73ED\u5C3C\u7279",
    "franchise": "GENSHIN",
    "month": 2,
    "day": 29,
    "enabled": true,
    "source": "qimiao-import.json",
    "sourceUrl": "",
    "evidence": ""
  },
  {
    "id": "640f384a-d562-47a0-946e-dd8aad8dc47e",
    "character": "\u83C8\u4E4C\u739B",
    "franchise": "GENSHIN",
    "month": 3,
    "day": 1,
    "enabled": true,
    "source": "qimiao-import.json",
    "sourceUrl": "",
    "evidence": ""
  },
  {
    "id": "143daf7e-0806-4240-9c8e-f914a66dc2a5",
    "character": "\u4E03\u4E03",
    "franchise": "GENSHIN",
    "month": 3,
    "day": 3,
    "enabled": true,
    "source": "qimiao-import.json",
    "sourceUrl": "",
    "evidence": ""
  },
  {
    "id": "34fe25fa-7ce6-4fdf-b680-7d52c64152c0",
    "character": "\u7476\u7476",
    "franchise": "GENSHIN",
    "month": 3,
    "day": 6,
    "enabled": true,
    "source": "qimiao-import.json",
    "sourceUrl": "",
    "evidence": ""
  },
  {
    "id": "8bfecf78-7f83-4a32-b661-005379a78a58",
    "character": "\u54E5\u4F26\u6BD4\u5A05",
    "franchise": "GENSHIN",
    "month": 3,
    "day": 7,
    "enabled": true,
    "source": "qimiao-import.json",
    "sourceUrl": "",
    "evidence": ""
  },
  {
    "id": "44755d05-5f8d-4def-933c-8bf5a08cf375",
    "character": "\u7533\u9E64",
    "franchise": "GENSHIN",
    "month": 3,
    "day": 10,
    "enabled": true,
    "source": "qimiao-import.json",
    "sourceUrl": "",
    "evidence": ""
  },
  {
    "id": "633f10a0-fc10-4acd-a0d8-a77ee80362e9",
    "character": "\u5E0C\u8BFA\u5B81",
    "franchise": "GENSHIN",
    "month": 3,
    "day": 13,
    "enabled": true,
    "source": "qimiao-import.json",
    "sourceUrl": "",
    "evidence": ""
  },
  {
    "id": "8d75a3f2-3d5a-4c5e-8686-719dc2f6ac16",
    "character": "\u675C\u6797",
    "franchise": "GENSHIN",
    "month": 3,
    "day": 14,
    "enabled": true,
    "source": "qimiao-import.json",
    "sourceUrl": "",
    "evidence": ""
  },
  {
    "id": "bb7d6b5f-bc9f-4b5e-846c-88961b4a7f9d",
    "character": "\u7434",
    "franchise": "GENSHIN",
    "month": 3,
    "day": 14,
    "enabled": true,
    "source": "qimiao-import.json",
    "sourceUrl": "",
    "evidence": ""
  },
  {
    "id": "f1d2c82e-a76a-4403-83ec-3ba007d930f6",
    "character": "\u68A6\u89C1\u6708\u745E\u5E0C",
    "franchise": "GENSHIN",
    "month": 3,
    "day": 16,
    "enabled": true,
    "source": "qimiao-import.json",
    "sourceUrl": "",
    "evidence": ""
  },
  {
    "id": "9dc049bf-d6ae-4f0a-b5ed-1c47da97c611",
    "character": "\u8BFA\u827E\u5C14",
    "franchise": "GENSHIN",
    "month": 3,
    "day": 21,
    "enabled": true,
    "source": "qimiao-import.json",
    "sourceUrl": "",
    "evidence": ""
  },
  {
    "id": "c2c9838f-8039-436b-9017-9aadffb297e7",
    "character": "\u4F0A\u6CD5",
    "franchise": "GENSHIN",
    "month": 3,
    "day": 23,
    "enabled": true,
    "source": "qimiao-import.json",
    "sourceUrl": "",
    "evidence": ""
  },
  {
    "id": "9464878c-bdc8-4426-a071-91b0962ae1c7",
    "character": "\u795E\u91CC\u7EEB\u4EBA",
    "franchise": "GENSHIN",
    "month": 3,
    "day": 26,
    "enabled": true,
    "source": "qimiao-import.json",
    "sourceUrl": "",
    "evidence": ""
  },
  {
    "id": "11fbb029-76a7-4c4f-bc3a-b0788ae8da98",
    "character": "\u5E0C\u683C\u96EF",
    "franchise": "GENSHIN",
    "month": 3,
    "day": 30,
    "enabled": true,
    "source": "qimiao-import.json",
    "sourceUrl": "",
    "evidence": ""
  },
  {
    "id": "0f20874c-8b86-4b41-acce-ea072b5a76f6",
    "character": "\u6D1B\u6069",
    "franchise": "GENSHIN",
    "month": 4,
    "day": 3,
    "enabled": true,
    "source": "qimiao-import.json",
    "sourceUrl": "",
    "evidence": ""
  },
  {
    "id": "d05ed638-787a-480f-a401-44733ed16fb5",
    "character": "\u57C3\u6D1B\u4F0A",
    "franchise": "GENSHIN",
    "month": 4,
    "day": 4,
    "enabled": true,
    "source": "qimiao-import.json",
    "sourceUrl": "",
    "evidence": ""
  },
  {
    "id": "8c6b5057-2a86-4c6f-aa16-57857e340e00",
    "character": "\u8FEA\u5E0C\u96C5",
    "franchise": "GENSHIN",
    "month": 4,
    "day": 7,
    "enabled": true,
    "source": "qimiao-import.json",
    "sourceUrl": "",
    "evidence": ""
  },
  {
    "id": "79fce6a4-0d32-425a-9c8e-b3e0cd5cd219",
    "character": "\u590F\u6D1B\u8482",
    "franchise": "GENSHIN",
    "month": 4,
    "day": 10,
    "enabled": true,
    "source": "qimiao-import.json",
    "sourceUrl": "",
    "evidence": ""
  },
  {
    "id": "92ea65c1-dd88-4d94-a805-14f3308caff8",
    "character": "\u95F2\u4E91",
    "franchise": "GENSHIN",
    "month": 4,
    "day": 11,
    "enabled": true,
    "source": "qimiao-import.json",
    "sourceUrl": "",
    "evidence": ""
  },
  {
    "id": "85d39392-5a66-4e2c-a11d-e6b1648e3c9c",
    "character": "\u9B48",
    "franchise": "GENSHIN",
    "month": 4,
    "day": 17,
    "enabled": true,
    "source": "qimiao-import.json",
    "sourceUrl": "",
    "evidence": ""
  },
  {
    "id": "fc95e899-f6d3-4934-b2c5-7fb9b4e0995f",
    "character": "\u591C\u5170",
    "franchise": "GENSHIN",
    "month": 4,
    "day": 20,